### ISSUE TITLE
Investigate networking issues on tentant clusters

### ISSUE THREAD

**Issue by larsks** [innabox/issues#112]
Deployed tenant clusters are unable to reach their own ingress via their public ip addresses.

Once a tenant cluster is deployed, one can reach e.g. `https://console-openshift-console.apps.../` from *outside* the cluster, but pods running on the cluster will time out trying to reach that address.

This results in the ingress and console cluster operators going into degraded mode...

```
$ k --kubeconfig kubeconfig  get co
NAME                                       VERSION   AVAILABLE   PROGRESSING   DEGRADED   SINCE   MESSAGE
console                                    4.17.0    False       False         True       4h27m   RouteHealthAvailable: failed to GET route (https://console-openshift-console.apps.order-qn9q6.box.massopen.cloud): Get "https://console-openshift-console.apps.order-qn9q6.box.massopen.cloud": context deadline exceeded (Client.Timeout exceeded while awaiting headers)
csi-snapshot-controller                    4.17.0    True        False         False      4h44m
dns                                        4.17.0    True        False         False      4h27m
image-registry                             4.17.0    True        False         False      4h28m
ingress                                    4.17.0    True        False         True       4h27m   The "default" ingress controller reports Degraded=True: DegradedConditions: One or more other status conditions indicate a degraded state: CanaryChecksSucceeding=False (CanaryChecksRepetitiveFailures: Canary route checks for the default ingress controller are failing. Last 1 error messages:...
```

...because they can't complete their health checks.

**Comment by larsks** [comment]
I'm just starting to take a closer look at this issue. This is the behavior we're seeing:

When we make a request from a worker node to an ingress route, e.g:

```
curl --local-port 44444 https://console-openshift-console.apps.order-qn9q6.box.massopen.cloud
```

We see the following traffic on interface `br-ex`:

```
15:52:41.306803 IP 172.17.1.103.44444 > 128.31.20.64.443: Flags [S], seq 2998978018, win 26880, options [mss 8960,sackOK,TS val 2015039985 ecr 0,nop,wscale 7], length 0
15:52:41.307386 IP 128.31.20.64.443 > 172.17.1.103.44444: Flags [S.], seq 3646449239, ack 2998978019, win 26844, options [mss 8960,sackOK,TS val 1201831978 ecr 2015039985,nop,wscale 7], length 0
15:52:41.307446 IP 172.17.1.103.44444 > 128.31.20.64.443: Flags [.], ack 1, win 210, options [nop,nop,TS val 2015039985 ecr 1201831978], length 0
15:52:41.353835 IP 172.17.1.103.44444 > 128.31.20.64.443: Flags [P.], seq 1:518, ack 1, win 210, options [nop,nop,TS val 2015040032 ecr 1201831978], length 517
15:52:41.354371 IP 128.31.20.64.443 > 172.17.1.103.44444: Flags [.], ack 518, win 206, options [nop,nop,TS val 1201832025 ecr 2015040032], length 0
```

And then after about 30 seconds:

```
15:53:11.356685 IP 128.31.20.64.443 > 172.17.1.103.44444: Flags [F.], seq 1546, ack 518, win 206, options [nop,nop,TS val 1201862027 ecr 2015040032], length 0
15:53:11.356728 IP 172.17.1.103.44444 > 128.31.20.64.443: Flags [.], ack 1, win 210, options [nop,nop,TS val 2015070035 ecr 1201832025,nop,nop,sack 1 {1546:1547}], length 0
15:54:11.618435 IP 172.17.1.103.44444 > 128.31.20.64.443: Flags [.], ack 1, win 210, options [nop,nop,TS val 2015130296 ecr 1201832025,nop,nop,sack 1 {1546:1547}], length 0
15:54:11.618959 IP 128.31.20.64.443 > 172.17.1.103.44444: Flags [R], seq 3646449240, win 0, length 0
```

You'll note that the first packet in that second block appears to be a second ack for the same sequence number, suggesting that the first packet never made it through.

**Comment by larsks** [comment]
It appears to only impact the ingress service, not the api service:

```
[root@moc-r4pac08u31-s3a /]# curl -k https://api.order-qn9q6.box.massopen.cloud:6443
{
  "kind": "Status",
  "apiVersion": "v1",
  "metadata": {},
  "status": "Failure",
  "message": "forbidden: User \"system:anonymous\" cannot get path \"/\"",
  "reason": "Forbidden",
  "details": {},
  "code": 403
[root@moc-r4pac08u31-s3a /]#
```

Compared to:

```
[root@moc-r4pac08u31-s3a /]# curl --connect-timeout 10 https://console-openshift-console.apps.order-qn9q6.box.massopen.cloud
curl: (28) Operation timed out after 10001 milliseconds with 0 out of 0 bytes received
```

**Comment by larsks** [comment]
There don't appear to be any netfilter rules that would impact this traffic, and in fact when enabling a trace rule (`iptables -t raw -A PREROUTING -s 128.31.20.64 -j TRACE`, where `128.31.20.64` is `console-openshift-console.apps.order-qn9q6.box.massopen.cloud`) shows a terminal `ACCEPT` rule:

```
PACKET: 2 493832bd IN=br-ex MACSRC=fa:16:3e:aa:f9:f1 MACDST=18:db:f2:a4:8d:1b MACPROTO=0800 SRC=128.31.20.64 DST=172.17.3.178 LEN=52 TOS=0x0 TTL=63 ID=40665 DF SPORT=443 DPORT=47056 ACK 
 TRACE: 2 493832bd raw:PREROUTING:rule:0x8:CONTINUE  -4 -t raw -A PREROUTING -s 128.31.20.64/32 -j TRACE
 TRACE: 2 493832bd raw:PREROUTING:rule:0x8:CONTINUE  -4 -t raw -A PREROUTING -s 128.31.20.64/32 -j TRACE
 TRACE: 2 493832bd raw:PREROUTING:policy:ACCEPT 
PACKET: 2 493832bd IN=br-ex MACSRC=fa:16:3e:aa:f9:f1 MACDST=18:db:f2:a4:8d:1b MACPROTO=0800 SRC=128.31.20.64 DST=172.17.3.178 LEN=52 TOS=0x0 TTL=63 ID=40665 DF SPORT=443 DPORT=47056 ACK 
 TRACE: 2 493832bd filter:INPUT:rule:0x9:JUMP:KUBE-FIREWALL  -4 -t filter -A INPUT -j KUBE-FIREWALL
 TRACE: 2 493832bd filter:KUBE-FIREWALL:rule:0xa:CONTINUE  -4 -t filter -A KUBE-FIREWALL ! -s 127.0.0.0/8 -d 127.0.0.0/8 -m comment --comment "block incoming localnet connections" -m conntrack ! --ctstate RELATED,ESTABLISHED,DNAT -j DROP
 TRACE: 2 493832bd filter:INPUT:policy:ACCEPT 
```

**Comment by larsks** [comment]
The routing table on the worker nodes looks like this:

```
sh-5.1# ip route
default via 172.17.0.1 dev br-ex proto dhcp src 172.17.1.103 metric 48
10.132.0.0/14 via 10.133.0.1 dev ovn-k8s-mp0
10.133.0.0/23 dev ovn-k8s-mp0 proto kernel scope link src 10.133.0.2
169.254.0.0/17 dev br-ex proto kernel scope link src 169.254.0.2
169.254.0.1 dev br-ex src 172.17.1.103
169.254.0.3 via 10.133.0.1 dev ovn-k8s-mp0
169.254.95.0/24 dev enp0s20f0u1u6 proto kernel scope link src 169.254.95.120 metric 101
169.254.169.254 via 172.17.0.11 dev br-ex proto dhcp src 172.17.1.103 metric 48
172.17.0.0/22 dev br-ex proto kernel scope link src 172.17.1.103 metric 48
172.20.0.1 dev lo scope link src 172.20.0.1
172.31.0.0/16 via 169.254.0.4 dev br-ex src 169.254.0.2 mtu 8900
```

**Comment by larsks** [comment]
I'm occasionally seeing failures like this when trying to start a debug pod:

```
$ k --kubeconfig kubeconfig  debug node/moc-r8pac23u26 -- chroot /host podman ps
Starting pod/moc-r8pac23u26-debug-lg7bm ...
To use host binaries, run `chroot /host`

Removing debug pod ...
Error from server: Get "https://172.17.1.103:10250/containerLogs/default/moc-r8pac23u26-debug-lg7bm/container-00?follow=true": net/http: TLS handshake timeout
```

(Where `172.17.1.103` is the address of the node itself.)

**Comment by larsks** [comment]
This looks interesting; I've started a simple service on one of the worker nodes to try to reproduce the problem in a more controlled fashion:

```
chroot /host podman run --network=host -e WHOAMI_PORT_NUMBER=8171 --name whoami -d docker.io/traefik/whoami
```

Lucky us, that *does* show the same behavior, but since we're running on a distinct port, it's easaier to isolate relevant traffic.  The output of `tcpdump` is interesting:

```
03:44:16.657141 br-ex Out IP 172.17.1.103.38300 > 128.31.20.64.8171: Flags [S], seq 2933691558, win 26880, options [mss 8960,sackOK,TS val 2043335335 ecr 0,nop,wscale 7], length 0
03:44:16.657161 eno1np0 Out IP 172.17.1.103.38300 > 128.31.20.64.8171: Flags [S], seq 2933691558, win 26880, options [mss 8960,sackOK,TS val 2043335335 ecr 0,nop,wscale 7], length 0
03:44:16.657392 eno1np0 In  IP 128.31.20.104.17697 > 172.17.1.103.8171: Flags [S], seq 2933691558, win 26880, options [mss 8960,sackOK,TS val 2043335335 ecr 0,nop,wscale 7], length 0
03:44:16.657456 br-ex In  IP 128.31.20.104.17697 > 172.17.1.103.8171: Flags [S], seq 2933691558, win 26880, options [mss 8960,sackOK,TS val 2043335335 ecr 0,nop,wscale 7], length 0
```

Note that the request is going to address `128.31.20.64`, but the reply is coming from `128.31.20.104`. That looks like a "hairpin nat" problem; that `128.31.20.104` address is the address of the router on the public network:

```
$ openstack router show idle-agents-router -c external_gateway_info -f value | sed s/"'"/'"'/g | sed 's/True/true/g' | jq
{
  "network_id": "71bdf502-a09f-4f5f-aba2-203fe61189dc",
  "external_fixed_ips": [
    {
      "subnet_id": "e1d5a5ca-947e-4e3e-9f7a-cee4619dc5c4",
      "ip_address": "128.31.20.104"
    }
  ],
  "enable_snat": true
}
```

So this becomes a NAT configuration issue on the openstack controllers.

**Comment by larsks** [comment]
Mainn and I were looking at this yesterday and now suspect that this is actually an MTU problem. We attempted to reproduce this behavior in another set of openstack machines and everything worked as expected. The working machines have a 1500 byte MTU while the machines experiencing difficulty have a 9000 byte MTU due to some recent changes on the ESI networking side.

I have adjusted the MTU setting on the networks we're using and I have re-imported the machines to openshift. I attempted to request a deployment yesterday and while the machines were registered successfully with ACM, they were not successfully deployed as worker nodes today's task is figuring out what went wrong.

**Comment by larsks** [comment]
Look, healthy cluster operators:

```
$ k --kubeconfig kubeconfig get co
NAME                                       VERSION   AVAILABLE   PROGRESSING   DEGRADED   SINCE   MESSAGE
console                                    4.17.0    True        False         False      22m
csi-snapshot-controller                    4.17.0    True        False         False      106m
dns                                        4.17.0    True        False         False      62m
image-registry                             4.17.0    True        False         False      63m
ingress                                    4.17.0    True        False         False      61m
insights                                   4.17.0    True        False         False      64m
kube-apiserver                             4.17.0    True        False         False      106m
kube-controller-manager                    4.17.0    True        False         False      106m
kube-scheduler                             4.17.0    True        False         False      106m
kube-storage-version-migrator              4.17.0    True        False         False      63m
monitoring                                 4.17.0    True        False         False      54m
network                                    4.17.0    True        False         False      69m
node-tuning                                4.17.0    True        False         False      62m
openshift-apiserver                        4.17.0    True        False         False      106m
openshift-controller-manager               4.17.0    True        False         False      106m
openshift-samples                          4.17.0    True        False         False      61m
operator-lifecycle-manager                 4.17.0    True        False         False      106m
operator-lifecycle-manager-catalog         4.17.0    True        False         False      105m
operator-lifecycle-manager-packageserver   4.17.0    True        False         False      106m
service-ca                                 4.17.0    True        False         False      64m
storage                                    4.17.0    True        False         False      106m
```
